{
  "schema": "measurement_policy.v3",
  "profile": "binary-event-directional.v1",
  "semantic_digest": "sha256:48cbd55d6a9119d40aa0bfef5f249eca3c05d557ff2283965de3e0dc3cdbb24c",
  "subject": {
    "subject_id": "synthetic.baseline.primary-status",
    "conditions": {}
  },
  "scope": "aggregate",
  "expected_case_ids": [
    "case-0",
    "case-1",
    "case-2",
    "case-3"
  ],
  "eprocess": {
    "p0": 0.5,
    "alpha_total": 0.05,
    "prior_a": 1,
    "prior_b": 1,
    "max_observations": null
  },
  "assumptions": {
    "conditional_mean_model": "unknown",
    "parameters_prespecified": "unknown",
    "order_prespecified": "unknown",
    "outcome_independent_selection": "unknown"
  },
  "diagnostics": {
    "ece_bins": 2,
    "min_bin_n": 2,
    "all_k": 2
  }
}
