{"assumptions":{"conditional_mean_model":"declared","order_prespecified":"declared","outcome_independent_selection":"declared","parameters_prespecified":"declared"},"diagnostics":{"all_k":2,"ece_bins":2,"min_bin_n":2},"eprocess":{"alpha_total":0.05,"max_observations":null,"p0":0.5,"prior_a":1,"prior_b":1},"expected_case_ids":["synthetic-case-0","synthetic-case-1","synthetic-case-2","synthetic-case-3","synthetic-case-4","synthetic-case-5","synthetic-case-6","synthetic-case-7"],"profile":"binary-event-directional.v1","schema":"measurement_policy.v3","scope":"aggregate","semantic_digest":"sha256:38aa1561c1fe293c27505baa3a05521be0c1cba96134d65c0c73572250447f0b","subject":{"conditions":{},"subject_id":"synthetic.event-rate"}}
